{
  "schema": "intyy.runspec/1.0",
  "kind": "negative_discovery",
  "caller": {
    "tenant": "keystone",
    "agent_id": "op_017"
  },
  "app": "kvfcu",
  "capability": "open_share_subaccount",
  "goal": "Open a share sub-account for member {input.member_id} with an opening deposit of {input.deposit}. Return the new account number.",
  "inputs": [
    {
      "name": "member_id",
      "type": "string",
      "description": "The member number of the account holder",
      "sensitivity": "pii",
      "example": "100101",
      "constraints": {
        "length": {
          "min": 6,
          "max": 6
        },
        "format": "digits"
      }
    },
    {
      "name": "deposit",
      "type": "money",
      "description": "The opening deposit for the new sub-account",
      "sensitivity": "financial",
      "example": "25.00",
      "constraints": {
        "range": {
          "min": "0.01"
        }
      }
    }
  ],
  "outputs": [],
  "expected_effect": "commits",
  "expected_outcome": {
    "code": "member_not_found",
    "description": "No member has this member number."
  },
  "correlation": "none",
  "session": "kvfcu/sign_in@1",
  "entry": "/main.do",
  "model": "claude-sonnet-5",
  "prompt": "discovery@1.0"
}
